{
  "region_id": "jacksonville",
  "market_code": "US-SE-JAX",
  "aliases": [],
  "place": "Jacksonville, Florida",
  "state": "FL",
  "coordinates": { "lat": 30.3322, "lon": -81.6557 },
  "classification": "metro",
  "city_center": {
    "name": "Downtown Jacksonville (St. Johns River / Riverside-Avondale)",
    "landmark": "St. Johns River waterfront and the Riverside Arts Market under the Fuller Warren Bridge; Atlantic beaches to the east",
    "notes": "North Florida river-and-coast metro. Publix (Lakeland FL headquarters) is the home grocer; Winn-Dixie (Jacksonville-founded) has deep local roots here. source: Publix and Winn-Dixie regional footprint."
  },
  "featured_frontier": {
    "hook": "North Florida citrus + Fernandina shrimp savory stack, eaten riverside under Spanish moss at the Riverside Arts Market",
    "photo_cue": "St. Johns River light, Spanish-moss live oaks, citrus segments, brick riverside market; Atlantic-coast morning",
    "signature_ingredient": "North Florida citrus (Nov-May) + spring blueberries; coastal shrimp savory tie",
    "cross_promo": {
      "partner": "Riverside Arts Market (Jacksonville)",
      "url": "https://www.riversideartsmarket.org/",
      "activation": "North Florida citrus glaze recipe card, Publix retailer lockup",
      "consent_status": "n/a"
    }
  },
  "audience": "North Florida river-and-beach families; Publix-first and Winn-Dixie-loyal Jacksonville households",
  "languages": [
    {
      "lang_code": "es",
      "lang_name": "Spanish",
      "translate_code": "es",
      "reason": "Spanish is the leading second home language across the Jacksonville metro. Percentage INFERRED (localization pipeline data absent from checkout) -- not an ACS figure"
    },
    {
      "lang_code": "tl",
      "lang_name": "Tagalog",
      "translate_code": "tl",
      "reason": "Jacksonville has a notable Filipino-American community tied to the Navy presence (NAS Jacksonville, Mayport). Percentage INFERRED, not an ACS figure"
    }
  ],
  "cultural_notes": [
    "Jacksonville is a North Florida river city built along the St. Johns, with a strong US Navy presence (NAS Jacksonville, Naval Station Mayport) shaping its communities (source: general regional knowledge; language selection flagged INFERRED)",
    "North Florida sits at the cooler end of the state's growing range: some frost-tender crops are available only in fall in North Florida while being harvested all winter farther south (source: UF/IFAS blogs.ifas.ufl.edu/fycsdept -- Florida winter produce)",
    "Florida's growing season peaks October through May, so citrus and strawberry are winter produce here, not a northern-style off-season (source: fdacs.gov Crops-in-Season; sarasotamagazine.com)",
    "Winn-Dixie was founded in Jacksonville and carries strong local heritage alongside Publix as the dominant statewide grocer (source: Winn-Dixie / Publix regional footprint)"
  ],
  "design_palette": {
    "textures": [
      "Spanish-moss drape",
      "tabby-and-shell coastal masonry",
      "weathered dock piling",
      "St. Johns River ripple",
      "live-oak bark",
      "brick riverside warehouse",
      "sea-oat grass"
    ],
    "colors": [
      {
        "name": "St. Johns River blue-gray",
        "hex": "#5A7A87",
        "use": "water / terrain"
      },
      {
        "name": "live-oak moss gray-green",
        "hex": "#8A9A7B",
        "use": "canopy / drape"
      },
      {
        "name": "Fernandina shrimp coral",
        "hex": "#E08A6E",
        "use": "produce / seafood accent"
      },
      {
        "name": "North Florida citrus gold",
        "hex": "#F0A93A",
        "use": "produce hero"
      },
      {
        "name": "coastal warehouse brick",
        "hex": "#8C4A3A",
        "use": "structure"
      }
    ],
    "building_materials": [
      "red fired brick (riverfront warehouses)",
      "tabby and shell coastal masonry",
      "wood-frame Riverside-Avondale bungalow",
      "steel-and-glass downtown",
      "dock timber"
    ],
    "landscape_motifs": [
      "St. Johns River bend",
      "Spanish-moss live-oak canopy",
      "Atlantic beach and dune",
      "riverside market under the bridge",
      "coastal shrimp boat"
    ]
  },
  "seasonal": [
    {
      "season": "winter-holidays",
      "months": [12, 1, 2],
      "in_season_produce": [
        {
          "name": "North Florida citrus (oranges, tangerines)",
          "peak_month": 1,
          "pancake_tie": "citrus glaze over Power Cakes -- peak North Florida citrus season is winter"
        }
      ],
      "where_to_buy": [
        { "name": "Publix (Jacksonville metro)", "type": "chain-grocer" },
        {
          "name": "Winn-Dixie (Jacksonville)",
          "type": "chain-grocer",
          "notes": "Jacksonville-founded grocer"
        }
      ]
    },
    {
      "season": "spring-easter",
      "months": [3, 4],
      "in_season_produce": [
        {
          "name": "Florida strawberries (late)",
          "peak_month": 3,
          "pancake_tie": "strawberry compote stack -- Florida strawberry runs into March"
        },
        {
          "name": "Florida blueberries",
          "peak_month": 4,
          "pancake_tie": "early blueberry Power Cakes -- Florida blueberries lead the spring crop"
        }
      ],
      "where_to_buy": [
        {
          "name": "Riverside Arts Market",
          "type": "farmers-market",
          "url": "https://www.riversideartsmarket.org/",
          "notes": "Saturday market under the Fuller Warren Bridge"
        },
        { "name": "Publix (Jacksonville metro)", "type": "chain-grocer" }
      ]
    },
    {
      "season": "summer-fourth",
      "months": [5, 6, 7, 8],
      "in_season_produce": [
        {
          "name": "Florida watermelon",
          "peak_month": 6,
          "pancake_tie": "watermelon side to a summer Power Cakes stack (watermelon Apr-Jul)"
        },
        {
          "name": "Florida sweet corn",
          "peak_month": 5,
          "pancake_tie": "sweet-corn cakes -- Florida sweet corn Oct-Jun"
        }
      ],
      "where_to_buy": [
        { "name": "Publix (Jacksonville metro)", "type": "chain-grocer" },
        { "name": "Riverside Arts Market", "type": "farmers-market" }
      ]
    },
    {
      "season": "harvest-fall",
      "months": [9, 10, 11],
      "in_season_produce": [
        {
          "name": "North Florida greens (collards, mustard)",
          "peak_month": 11,
          "pancake_tie": "savory greens-and-cheddar Power Cakes -- North Florida fall greens tie (INFERRED pancake tie, verify)"
        }
      ],
      "where_to_buy": [
        { "name": "Publix (Jacksonville metro)", "type": "chain-grocer" }
      ]
    }
  ],
  "retailers": [
    { "name": "Publix", "role": "home" },
    { "name": "Winn-Dixie", "role": "primary" },
    { "name": "Walmart", "role": "secondary" },
    { "name": "Target", "role": "secondary" }
  ],
  "campaign_type_fit": {
    "localized-costco": {
      "fit": "strong",
      "angle": "Publix-heartland variant with a Winn-Dixie local-heritage twist unique to Jacksonville; reuse briefs/kodiak-costco.yaml pattern",
      "existing_brief": "briefs/kodiak-costco.yaml"
    },
    "recipe-cards": {
      "fit": "strong",
      "angle": "North Florida citrus glaze card + coastal-shrimp savory Power Cakes card + spring blueberry card"
    },
    "riff-on-past-content": {
      "fit": "weak",
      "angle": "no known prior Jacksonville creative to riff on"
    },
    "zac-efron": {
      "fit": "na",
      "angle": "no celebrity tie identified; archetype only, never likeness"
    },
    "bears": {
      "fit": "weak",
      "angle": "Florida black bear present statewide; keep conservation-toned, tracks-only, no grizzly hook"
    },
    "keep-it-wild": {
      "fit": "weak",
      "angle": "Atlantic-coast and river wild angle possible but metro market"
    },
    "us-ski-and-snowboard": {
      "fit": "na",
      "angle": "no ski culture; coastal subtropical"
    }
  },
  "readiness": {
    "fields": {
      "city_center": "ready",
      "featured_frontier": "ready",
      "audience": "ready",
      "languages": "thin",
      "cultural_notes": "ready",
      "design_palette": "ready",
      "seasonal": "ready",
      "retailers": "ready",
      "campaign_type_fit": "ready"
    },
    "score": 0.83,
    "ready_to_rock": true,
    "notes": "North Florida river-city record, season-honest (winter citrus). Winn-Dixie heritage called out as the Jacksonville-founded local hook. languages thin -- INFERRED, no ACS numbers fabricated. hex flagged for brand-fit review. fall greens pancake tie carries an INFERRED flag."
  },
  "provenance": {
    "sourced_from": [
      "web: Florida crops in season -- fdacs.gov/Food-Nutrition/Buy-Fresh-From-Florida/Crops-in-Season",
      "web: North Florida winter produce timing -- blogs.ifas.ufl.edu/fycsdept (UF/IFAS)",
      "web: Florida growing season Oct-May -- sarasotamagazine.com",
      "Winn-Dixie Jacksonville founding + Publix statewide footprint -- general regional retail knowledge",
      "language percentages INFERRED -- localization pipeline data absent from checkout; no ACS figure fabricated"
    ],
    "generated": "2026-09-04T00:00:00Z"
  }
}
